id,name,category,url,description,main_scope,relationship,last_checked,verified,notes
awesome-world-models,Awesome World Models,general_world_model_collections,https://github.com/JiahuaDong/Awesome-World-Models,Survey-linked collection spanning reinforcement-learning observation-level latent and object-centric world models,General world-model literature and resources,Complementary general world-model collection with broader AI coverage and no PHM-specific screening workflow,2026-07-16,true,Official GitHub README inspected
phm-vibench,PHM-Vibench,phm_frameworks_benchmarks,https://github.com/PHMbench/PHM-Vibench,Factory-style vibration PHM platform with configurable data model task and trainer components,Vibration-based PHM training and evaluation infrastructure,Existing PHM training and evaluation infrastructure that can inform future protocol integration,2026-07-16,true,Official GitHub README and PHM Society paper inspected
mtsbench,mTSBench,time_series_anomaly_detection_benchmarks,https://github.com/PLAN-Lab/mTSBench,Multivariate time-series anomaly benchmark with 344 labeled series 24 detectors and detector-selection evaluation,Multivariate time-series anomaly detection benchmarking,Anomaly-detection evaluation benchmark complementary to mechanism-centered literature classification,2026-07-16,true,Official GitHub README inspected
tsb-ad,TSB-AD,time_series_anomaly_detection_benchmarks,https://github.com/TheDatumOrg/TSB-AD,Reliable time-series anomaly-detection benchmark with datasets algorithms metrics tutorials and leaderboard,Time-series anomaly detection evaluation,Anomaly-detection evaluation benchmark and possible future protocol comparison target,2026-07-16,true,Official GitHub README inspected
rul-papers,RUL-Papers,rul_prognostics_resources,https://github.com/RamtinMoslemi/RUL-Papers,Automatically maintained index of arXiv papers on RUL state of health and predictive maintenance,RUL and prognostics literature indexing,RUL literature index with broad recall but a different automated collection and verification scope,2026-07-16,true,Official GitHub repository and generated project page inspected
batteryml,BatteryML,rul_prognostics_resources,https://github.com/microsoft/BatteryML,Open-source battery degradation toolkit with public datasets and SOH and RUL benchmark pipelines,Battery degradation modeling and RUL benchmarking,Existing degradation and RUL infrastructure and a possible future integration target,2026-07-16,true,Official GitHub README inspected
aws-fleet-predictive-maintenance,AWS Fleet Predictive Maintenance,predictive_maintenance_collections,https://github.com/awslabs/aws-fleet-predictive-maintenance,SageMaker solution assets for vehicle-fleet sensor preparation model training and predictive-maintenance proof of concept,Vehicle-fleet predictive maintenance implementation,Adjacent predictive-maintenance resource with a deployment-oriented rather than survey-oriented primary scope,2026-07-16,true,Official GitHub README inspected
moment,MOMENT,time_series_foundation_model_resources,https://github.com/moment-timeseries-foundation-model/moment,Open time-series foundation models and research code for forecasting classification imputation anomaly detection and representation learning,General-purpose time-series foundation modeling,Possible future integration target whose pretrained representations are not automatically PHM world models,2026-07-16,true,Official GitHub README inspected
